{
  "schema_version": "1.0",
  "generator": {
    "vendor": "OraDiscuss",
    "source": "https://oradiscuss.com",
    "pack": "healthcheck",
    "pack_version": "1.0.0",
    "script": "health_check.sh",
    "notice": "Generated locally by OraDiscuss tooling. Not produced by, affiliated with, or endorsed by Oracle Corporation."
  },
  "collection": {
    "generated_at": "2026-08-08T23:07:08+0300",
    "oracle_sid": "ODCDEMO1",
    "read_only": true,
    "collector_exit_code": 2,
    "data_residency": "This file was written on the machine that ran the collector. OraDiscuss never receives it."
  },
  "summary": {
    "overall_status": "CRIT",
    "counts": {
      "OK": 16,
      "WARN": 4,
      "CRIT": 1,
      "NA": 4
    },
    "needs_attention": ["TS_APPDATA","INVALID_OBJECTS","ALERT_ORA_ERRORS","FRA_USAGE","ASM_RECO"]
  },
  "thresholds": {"tablespace_warn_pct":85,"tablespace_crit_pct":95,"asm_warn_pct":80,"asm_crit_pct":90,"fra_warn_pct":80,"fra_crit_pct":90,"rman_full_max_age_hours":30,"rman_arch_max_age_hours":8,"invalid_object_warn":1},
  "checks": [{"id":"INSTANCE_STATUS","section":"Instance & Database","status":"OK","title":"Instance status","detail":"ODCDEMO1 on dbnode1.odclab.example - status OPEN, version 19.26.0.0.0, up since 2026-07-29 02:14","metrics":{}},{"id":"DATABASE_STATUS","section":"Instance & Database","status":"OK","title":"Database status","detail":"ODCDEMO (PRIMARY) open_mode=READ WRITE, log_mode=ARCHIVELOG","metrics":{}},{"id":"CLUSTER_SCOPE","section":"Instance & Database","status":"OK","title":"Collection scope","detail":"RAC, 2 instances. Cluster-wide here: tablespaces, invalid objects, jobs, RMAN, FRA, ASM. Local to the instance this ran against only: instance status, alert log, listener. Run the pack on each node, or read those three as describing one node.","metrics":{}},{"id":"CLUSTER_INSTANCES","section":"Instance & Database","status":"OK","title":"Cluster instances","detail":"2 of 2 instance(s) OPEN","metrics":{"instances_total":{"value":2,"unit":"instances"},"instances_open":{"value":2,"unit":"instances"}}},{"id":"TS_APPDATA","section":"Tablespace Usage","status":"WARN","title":"Tablespace APPDATA","detail":"88.6% used (750.0 GB max, 664.5 GB used)","metrics":{"used_pct":{"value":88.6,"unit":"percent"},"used_gb":{"value":664.5,"unit":"GB"},"max_gb":{"value":750.0,"unit":"GB"}}},{"id":"TS_APPIDX","section":"Tablespace Usage","status":"OK","title":"Tablespace APPIDX","detail":"61.3% used (400.0 GB max, 245.2 GB used)","metrics":{"used_pct":{"value":61.3,"unit":"percent"},"used_gb":{"value":245.2,"unit":"GB"},"max_gb":{"value":400.0,"unit":"GB"}}},{"id":"TS_SYSAUX","section":"Tablespace Usage","status":"OK","title":"Tablespace SYSAUX","detail":"52.7% used (16.0 GB max, 8.4 GB used)","metrics":{"used_pct":{"value":52.7,"unit":"percent"},"used_gb":{"value":8.4,"unit":"GB"},"max_gb":{"value":16.0,"unit":"GB"}}},{"id":"TS_SYSTEM","section":"Tablespace Usage","status":"OK","title":"Tablespace SYSTEM","detail":"38.4% used (8.0 GB max, 3.1 GB used)","metrics":{"used_pct":{"value":38.4,"unit":"percent"},"used_gb":{"value":3.1,"unit":"GB"},"max_gb":{"value":8.0,"unit":"GB"}}},{"id":"TS_UNDOTBS1","section":"Tablespace Usage","status":"OK","title":"Tablespace UNDOTBS1","detail":"22.9% used (32.0 GB max, 7.3 GB used)","metrics":{"used_pct":{"value":22.9,"unit":"percent"},"used_gb":{"value":7.3,"unit":"GB"},"max_gb":{"value":32.0,"unit":"GB"}}},{"id":"TS_USERS","section":"Tablespace Usage","status":"OK","title":"Tablespace USERS","detail":"4.8% used (2.0 GB max, 0.1 GB used)","metrics":{"used_pct":{"value":4.8,"unit":"percent"},"used_gb":{"value":0.1,"unit":"GB"},"max_gb":{"value":2.0,"unit":"GB"}}},{"id":"INVALID_OBJECTS","section":"Objects & Jobs","status":"WARN","title":"Invalid objects","detail":"7 invalid object(s) in the database","metrics":{"count":{"value":7,"unit":"objects"}}},{"id":"FAILED_SCHED_JOBS","section":"Objects & Jobs","status":"OK","title":"Failed scheduler jobs (7d)","detail":"0 failed scheduler job run(s) in the last 7 days","metrics":{}},{"id":"BROKEN_JOBS","section":"Objects & Jobs","status":"OK","title":"Broken DBA_JOBS","detail":"0 broken legacy job(s)","metrics":{}},{"id":"ADR_LOCATION","section":"Alert Log (last 24h)","status":"NA","title":"ADR diagnostic destination","detail":"/u01/app/oracle/diag/rdbms/odcdemo/ODCDEMO1/trace","metrics":{}},{"id":"ALERT_ORA_ERRORS","section":"Alert Log (last 24h)","status":"WARN","title":"ORA- errors in alert log (24h)","detail":"3 ORA- error line(s) in the last 24 hours","metrics":{}},{"id":"ALERT_SAMPLE_1","section":"Alert Log (last 24h)","status":"NA","title":"Recent ORA- sample","detail":"08-07 23:41 ORA-19815: WARNING: db_recovery_file_dest_size of 1649267441664 bytes is 94.62% used, and has 88707792896 remaining bytes available.","metrics":{}},{"id":"ALERT_SAMPLE_2","section":"Alert Log (last 24h)","status":"NA","title":"Recent ORA- sample","detail":"08-07 21:08 ORA-01654: unable to extend index APPOWNER.IX_ORDER_LINE_DT by 128 in tablespace APPIDX","metrics":{}},{"id":"ALERT_SAMPLE_3","section":"Alert Log (last 24h)","status":"NA","title":"Recent ORA- sample","detail":"08-07 04:52 ORA-00060: Deadlock detected. More info in file /u01/app/oracle/diag/rdbms/odcdemo/ODCDEMO1/trace/odcdemo1_ora_48211.trc","metrics":{}},{"id":"ARCHIVELOG_MODE","section":"Archivelog & FRA","status":"OK","title":"Archivelog mode","detail":"Database log_mode = ARCHIVELOG","metrics":{}},{"id":"FRA_USAGE","section":"Archivelog & FRA","status":"CRIT","title":"FRA (DB_RECOVERY_FILE_DEST) usage","detail":"+RECO - 94.6% used (1453.4 GB of 1536.0 GB)","metrics":{"used_pct":{"value":94.6,"unit":"percent"}}},{"id":"ASM_DATA","section":"ASM Diskgroups","status":"OK","title":"ASM diskgroup DATA","detail":"64.2% used (2630.7 GB of 4096.0 GB)","metrics":{}},{"id":"ASM_RECO","section":"ASM Diskgroups","status":"WARN","title":"ASM diskgroup RECO","detail":"83.9% used (3436.5 GB of 4096.0 GB)","metrics":{}},{"id":"RMAN_DB_INCR","section":"RMAN Backup Recency","status":"OK","title":"Last DB INCR backup","detail":"2026-08-08 01:12 (9.4 hours ago, status COMPLETED)","metrics":{}},{"id":"RMAN_ARCHIVELOG","section":"RMAN Backup Recency","status":"OK","title":"Last ARCHIVELOG backup","detail":"2026-08-08 10:05 (0.5 hours ago, status COMPLETED)","metrics":{}},{"id":"LISTENER","section":"Listener","status":"OK","title":"Listener","detail":"listener LISTENER is up","metrics":{}}]
}
